|Royal Canin Medium Dermacomfort Dry Dog Food| 150.5
|Royal Canin Medium Dermacomfort Dry Dog Food| 385.5
|Royal Canin Medium Dermacomfort Dry Dog Food| 506.0
|Royal Canin West Highland White Terrier Adult Dry Dog Food 3KG| 178.5
|Royal Canin Mini Indoor Life Adult Dry Dog Food 1.5KG| 94.0
|Royal Canin Mini Puppy Dry Food| 326.5
|Royal Canin Mini Puppy Dry Food| 108.0
|Royal Canin Mini Puppy Dry Food| 52.5
|Royal Canin Indoor Life Puppy Dry Food 1.5KG| 101.5
|Royal Canin Babydog Milk 400G| 182.0
|Royal Canin Mini Adult Dry Dog Food| 46.5
|Royal Canin Mini Adult Dry Dog Food| 99.5
|Royal Canin Mini Adult Dry Dog Food| 305.5
|Royal Canin Beagle Adult Dry Dog Food 3KG| 174.5
|Royal Canin Bulldog Adult Dry Dog Food 12KG| 428.5
|Royal Canin Cavalier King Charles Spaniel Puppy Dry Food 1.5KG| 121.5
|Royal Canin Cavalier King Charles Spaniel Adult Dry Dog Food 1.5KG| 103.0
|Royal Canin Chihuahua Adult Dry Dog Food 1.5KG| 103.0
|Royal Canin Chihuahua Puppy Dry Food 1.5KG| 121.0
|Royal Canin Cocker Spaniel Puppy Dry Food 3KG| 182.5
|Royal Canin Cocker Spaniel Adult Dry Dog Food 3KG| 170.0
|Royal Canin Dachshund Adult Dry Dog Food 1.5KG| 106.0
|Royal Canin Dachshund Puppy Dry Food 1.5KG| 121.0
|Royal Canin Dalmatian Adult Dry Dog Food 12KG| 465.5
|Royal Canin French Bulldog Adult Dry Dog Food 3KG| 177.5
|Royal Canin German Shepherd Adult Dry Dog Food| 391.5
|Royal Canin German Shepherd Adult Dry Dog Food| 139.0
|Royal Canin Giant Adult Dry Dog Food 15KG| 427.0
|Royal Canin Giant Junior Dry Dog Food 15KG| 457.0
|Royal Canin Golden Retriever Puppy Dry Food 12kg| 468.0
|Royal Canin Golden Retriever Adult Dry Dog Food 12kg| 428.5
|Royal Canin Great Dane Adult Dry Dog Food 12KG| 428.5
|Royal Canin German Shepherd Puppy Dry Food| 468.0
|Royal Canin German Shepherd Puppy Dry Food| 152.0
|Royal Canin Labrador Retriever Adult Dry Dog Food| 139.0
|Royal Canin Labrador Retriever Adult Dry Dog Food| 428.5
|Royal Canin Labrador Retriever Puppy Dry Food| 152.0
|Royal Canin Labrador Retriever Puppy Dry Food| 468.0
|Royal Canin Jack Russell Terrier Adult Dry Dog Food 1.5KG| 111.5
|Royal Canin Maltese Adult Dry Dog Food 1.5KG| 103.0
|Royal Canin Maxi Adult Dry Dog Food| 314.0
|Royal Canin Maxi Adult Dry Dog Food| 424.0
|Royal Canin Maxi Adult Dry Dog Food| 157.5
|Royal Canin Maxi Adult Dry Dog Food| 43.0
|Royal Canin Maxi Puppy Dry Food| 354.0
|Royal Canin Maxi Puppy Dry Food| 453.5
|Royal Canin Maxi Puppy Dry Food| 52.5
|Royal Canin Maxi Puppy Dry Food| 177.0
|Royal Canin Maxi Starter Mother & Babydog Dry Food| 536.5
|Royal Canin Maxi Starter Mother & Babydog Dry Food| 180.5
|Royal Canin Medium Adult 7+ Dry Dog Food| 306.0
|Royal Canin Medium Adult 7+ Dry Dog Food| 153.5
|Royal Canin Medium Adult Dry Dog Food| 296.0
|Royal Canin Medium Adult Dry Dog Food| 414.5
|Royal Canin Medium Adult Dry Dog Food| 147.0
|Royal Canin Medium Adult Dry Dog Food| 43.0
|Royal Canin Medium Puppy Dry Food| 329.5
|Royal Canin Medium Puppy Dry Food| 52.5
|Royal Canin Medium Puppy Dry Food| 169.5
|Royal Canin Medium Puppy Dry Food| 412.5
|Royal Canin Medium Light Adult Dry Dog Food| 136.0
|Royal Canin Medium Light Adult Dry Dog Food| 317.5
|Royal Canin Medium Light Adult Dry Dog Food| 413.0
|Royal Canin Medium Starter Mother & Babydog Dry Dog Food 4KG| 198.0
|Royal Canin Mini Adult 8+ Dry Dog Food| 101.5
|Royal Canin Mini Adult 8+ Dry Dog Food| 273.0
|Royal Canin Mini Schnauzer Adult Dry Dog Food 3KG| 175.5
|Royal Canin Mini Starter Puppy Dry Food 1KG| 80.5
|Royal Canin Poodle Adult Dry Dog Food| 106.0
|Royal Canin Poodle Adult Dry Dog Food| 379.0
|Royal Canin Pug Adult Dry Dog Food| 103.0
|Royal Canin Pug Adult Dry Dog Food| 370.0
|Royal Canin Pug Puppy Dry Food 1.5KG| 122.5
|Royal Canin Rottweiler Adult Dry Dog Food 12KG| 428.5
|Royal Canin Shih Tzu Adult Dry Dog Food| 108.5
|Royal Canin Shih Tzu Adult Dry Dog Food| 393.0
|Royal Canin Shih Tzu Puppy Dry Food 1.5KG| 121.0
|Royal Canin Medium Ageing 10+ Dry Dog Food 3KG| 135.0
|Royal Canin X-Small Adult Dry Dog Food 1.5KG| 94.5
|Royal Canin X-Small Puppy Dry Food 1.5KG| 103.0
|Royal Canin X-Small Adult 8+ Dry Dog Food 1.5KG| 94.5
|Royal Canin Yorkshire Terrier Adult Dry Dog Food 1.5KG| 100.0
|Royal Canin Yorkshire Terrier Puppy Dry Food 1.5KG| 113.0
|Royal Canin Giant Puppy Dry Food 15KG| 471.0
|Royal Canin Maxi Ageing 8+ Adult Dry Dog Food 15KG| 478.5
|Royal Canin Maxi Adult 5+ Dry Dog Food 15KG| 424.5
|Royal Canin Maxi Adult Dermacomfort Dry Dog Food| 348.5
|Royal Canin Maxi Adult Dermacomfort Dry Dog Food| 143.0
|Royal Canin Maxi Adult Dermacomfort Dry Dog Food| 457.0
|Royal Canin Mini Adult Dermacomfort Dry Dog Food 3KG| 177.0
|Royal Canin Maxi Light Adult Dry Dog Food| 301.0
|Royal Canin Maxi Light Adult Dry Dog Food| 383.5
|Royal Canin Mini Light Adult Dry Dog Food 3KG| 151.5
|Royal Canin Mini Digestive Care Adult Dry Dog Food 3KG| 160.0
|Royal Canin Bichon Frise Adult Dry Dog Food 1.5KG| 103.0
|Royal Canin Mini Sterilised Adult Dry Dog Food| 160.0
|Royal Canin Mini Sterilised Adult Dry Dog Food| 291.0
|Royal Canin Mother & Babycat Adult Wet Cat Food 195g| 21.5
|Royal Canin British Shorthair Adult Dry Cat Food 4KG| 258.0
|Royal Canin Kitten Instinctive in Gravy Wet Food 85G| 8.04
|Royal Canin Persian Kitten Dry Food| 148.5
|Royal Canin Persian Kitten Dry Food| 36.0
|Royal Canin Ageing 12+ Dry Cat Food 2KG| 148.5
|Royal Canin Savour Exigent Adult Dry Cat Food| 134.0
|Royal Canin Savour Exigent Adult Dry Cat Food| 235.0
|Royal Canin Savour Exigent Adult Dry Cat Food| 499.0
|Royal Canin Regular Fit 32 Adult Dry Cat Food| 35.0
|Royal Canin Regular Fit 32 Adult Dry Cat Food| 117.0
|Royal Canin Regular Fit 32 Adult Dry Cat Food| 205.0
|Royal Canin Regular Fit 32 Adult Dry Cat Food| 429.0
|Royal Canin Indoor Appetite Control Adult Dry Cat Food 2KG| 139.5
|Royal Canin Indoor Long Hair Dry Cat Food 2KG| 134.0
|Royal Canin Kitten Dry Food| 477.5
|Royal Canin Kitten Dry Food| 126.0
|Royal Canin Kitten Dry Food| 36.0
|Royal Canin Kitten Dry Food| 220.5
|Royal Canin Maine Coon Adult Dry Cat Food 2KG| 139.0
|Royal Canin Mother & Babycat Dry Cat Food| 132.5
|Royal Canin Mother & Babycat Dry Cat Food| 37.5
|Royal Canin Mother & Babycat Dry Cat Food| 217.5
|Royal Canin Mother & Babycat Dry Cat Food| 489.0
|Royal Canin Persian Adult Dry Cat Food| 488.5
|Royal Canin Persian Adult Dry Cat Food| 139.0
|Royal Canin Persian Adult Dry Cat Food| 240.0
|Royal Canin Persian Adult Dry Cat Food| 409.5
|Royal Canin Persian Adult Dry Cat Food| 37.0
|Royal Canin Siamese Adult Dry Cat Food 2KG| 139.0
|Royal Canin Babycat Milk Powder 300G| 162.0
|Royal Canin Kitten Sterilised Dry Food 2KG| 140.5
|Royal Canin Norwegian Forest Cat 2KG| 139.0
|Royal Canin Ragdoll Adult Dry Cat Food 2KG| 139.0
|Royal Canin Hair & Skin Adult Dry Cat Food| 134.0
|Royal Canin Hair & Skin Adult Dry Cat Food| 234.0
|Royal Canin Hair & Skin Adult Dry Cat Food| 486.5
|Royal Canin Hair & Skin Adult Dry Cat Food| 37.0
|Royal Canin Hairball Care Adult Dry Cat Food| 129.0
|Royal Canin Hairball Care Adult Dry Cat Food| 222.0
|Royal Canin Hairball Care Adult Dry Cat Food| 478.5
|Royal Canin Hairball Care Adult Dry Cat Food| 34.5
|Royal Canin Home Life Indoor 7+ Dry Cat Food| 100.5
|Royal Canin Home Life Indoor 7+ Dry Cat Food| 192.5
|Royal Canin Sterilised 37 Adult Dry Cat Food| 134.0
|Royal Canin Sterilised 37 Adult Dry Cat Food| 35.0
|Royal Canin Bengal Adult Dry Cat Food 2KG| 139.0
|Royal Canin Digestive Care Adult Dry Cat Food| 141.0
|Royal Canin Digestive Care Adult Dry Cat Food| 35.5
|Royal Canin Urinary Care Adult Dry Cat Food| 141.0
|Royal Canin Urinary Care Adult Dry Cat Food| 35.5
|Royal Canin Urinary Care Adult Dry Cat Food| 240.0
|Royal Canin Dental Care Adult Dry Cat Food 1.5KG| 109.5
|Royal Canin Maine Coon Kitten Dry Food 2KG| 148.5
|Royal Canin British Shorthair Kitten Dry Food 2KG| 148.5
|Royal Canin Active Life Outdoor Adult Dry Cat Food 2KG| 129.0
|Armitage Good Boy Chewy Chicken Strips Dog Treat| 79.0
|Armitage Good Boy Chewy Chicken Strips Dog Treat| 29.5
|Armitage Good Boy Chewy Chicken Twists Dog Treats| 77.0
|Armitage Good Boy Chewy Chicken Twists Dog Treats| 28.5
|Armitage Good Boy Jumbo Chewy Chicken Twists Dog Treats 100G| 32.5
|Armitage Good Boy Deli Bites Beef Dog Treats 65G| 18.0
|Armitage Good Boy Deli Bites Chicken Dog Treats 65G| 17.0
|Armitage Good Boy Deli Bites Duck Dog Treats 65G| 17.0
|Armitage Good Boy Tender Beef Fillets Dog Treats 90G| 32.5
|Armitage Good Boy Tender Duck Fillets Dog Treats 80G| 32.5
|Royal Canin Chihuahua Adult Wet Dog Food 85G| 7.46
|Royal Canin Dachshund Adult Wet Dog Food 85G| 7.46
|Royal Canin Poodle Adult Wet Dog Food 85G| 7.46
|Royal Canin Yorkshire Terrier Adult Wet Dog Food 85G| 7.46
|Royal Canin Starter Mousse Puppy Wet Food 195G| 13.58
|Royal Canin Mini Puppy Wet Food 85g| 7.33
|Royal Canin Medium Puppy Wet Food 140g| 10.3
|Royal Canin Maxi Puppy Wet Food 140g| 10.0
|Royal Canin Mini Adult Wet Dog Food 85g| 7.13
|Royal Canin Medium Adult Wet Dog Food 140g| 9.55
|Royal Canin Maxi Adult Wet Dog Food 140G| 9.35
|Royal Canin Digest Sensitive Adult Wet Cat Food| 8.04
|Royal Canin Ageing 12+ Adult  Chunks in Gravy Wet Cat Food 85G| 8.04
|Royal Canin Instinctive 7+ Adult Wet Cat Food 85G| 8.04
|Royal Canin Instinctive Adult in Gravy Wet Cat Food 85G| 8.04
|Royal Canin Feline Care Nutrition Hair & Skin in Gravy Adult Wet Cat Food 85G| 8.04
|Royal Canin Sterilised in Gravy Wet Cat Food 85G| 8.04
|Royal Canin Kitten Instinctive in Jelly Wet Food 85G| 8.04
|Royal Canin Light Weight Care in Gravy Adult Wet Cat Food| 8.04
|Royal Canin Instinctive Adult in Jelly Wet Cat Food 85G| 8.04
|Royal Canin Hair & Skin in Jelly Adult Wet Cat Food| 8.04
|Royal Canin Hairball Care in Gravy Adult Wet Cat Food 85g| 8.04
|Royal Canin British Shorthair Adult Wet Cat Food 85G| 8.04
|Royal Canin Persian Adult Wet Cat Food 85g| 8.04
|Royal Canin Kitten Sterilised in Gravy Wet Food 85G| 8.04
|Royal Canin Urinary Care in Gravy Adult Wet Cat Food 85g| 8.04
|Royal Canin Maine Coon Adult Wet Cat Food 85G| 8.04
|Beaphar Care+ Chinchilla Food 1.5KG| 72.0
|Beaphar Care+ Hamster Food 700G| 40.5
|Beaphar Care+ Dry Rabbit Food| 395.0
|Beaphar Care+ Dry Rabbit Food| 219.5
|Beaphar Care+ Dry Rabbit Food| 72.0
|Exotic Nutrition Hedgehog Complete Food 2.27KG| 189.0
|Beaphar Care+ Guinea Pig Food 1.5KG| 72.0
|Beaphar Care+ Junior Rabbit Food 1.5KG| 72.0
|Beaphar XtraVital Adult Guinea Pig Food| 41.0
|Beaphar XtraVital Adult Guinea Pig Food| 86.0
|Beaphar XtraVital Adult Rabbit Food| 83.5
|Beaphar XtraVital Adult Rabbit Food| 41.0
|ZuPreem Nature's Promise Rabbit Food 5lbs| 70.0
|Beaphar Care+ Rabbit Senior Food 1.5KG| 72.0
|Beaphar Catnip Bits Cat Treats| 37.0
|Beaphar Catnip Bits Cat Treats| 16.0
|Beaphar Catnip Salmon Bits Cat Treats 35G| 16.0
|JBL NovoPleco Chips Fish Food 100ML| 29.5
|JBL Artemia Salt Brine Shrimp Food for Fish 230G| 32.5
|Ocean Nutrition Instant Baby Brine Shrimp Food for Fish 20G| 69.0
|Ocean Nutrition Green Marine Algae Fish Food 12G| 37.0
|Ocean Nutrition Brown Marine Algae Fish Food 12G| 35.0
|Ocean Nutrition Red Marine Algae Fish Food 8G| 30.5
|Seachem Jurassi Quench for Reptiles 180G| 28.0
|JBL Agil Turtle Food| 90.0
|JBL Agil Turtle Food| 32.5
|Seachem EasiCricket Moist Reptile & Amphibian Treats| 31.5
|Seachem EasiCricket Moist Reptile & Amphibian Treats| 31.5
|JBL Agivert for Reptiles 250ML| 30.0
|Zupreem Real Reward Large Tropical Parrot Treats 170G| 29.51
|Zolux Crunchy Cake Apple & Banana Biscuits Bird Treats 75G| 24.0
|Zolux Crunchy Cake Honey Biscuits Bird Treats 75G| 24.0
|Zolux Crunchy Soft Fruity Mash Bird Treats 150G| 22.0
|Zolux Crunchy Soft Omny Mash Bird Treats 150G| 22.0
|ZuPreem VeggieBlend Medium and Large Parrot Food 3.5lbs| 112.0
|ZuPreem FruitBlend Medium and Large Parrot Food| 287.5
|ZuPreem FruitBlend Medium and Large Parrot Food| 73.5
|ZuPreem FruitBlend Medium and Large Parrot Food| 108.0
|ZuPreem FruitBlend Adult Large Parrot Food| 108.0
|ZuPreem FruitBlend Adult Large Parrot Food| 294.0
|ZuPreem Natural Diet Large Parrot Food 3.5lbs| 94.5
|ZuPreem FruitBlend Medium Parrot Food 2lbs| 73.5
|FARMA Budgie Mix Natural Bird Food 20KG| 158.5
|FARMA Finch Mix Natural Bird Food 20KG| 171.5
|FARMA Parakeet Mix Premium Natural Diet for Parrot 20KG| 166.01
|FARMA Exotic Mix Natural Bird Food 20KG| 169.5
|FARMA Parrot Mix Medium to Large Bird Food 15KG| 171.5
|ZuPreem Pure Fun Large Parrot Food 2lbs| 92.0
|ZuPreem Pure Fun Parrots & Conures Food 2lbs| 92.0
|ZuPreem Pure Fun Medium Bird Food 2lbs| 80.5
|FARMA Budgie Budget Mix Seed Food for Small Parakeets 20KG| 146.5
|Acana Small Breed Adult Dry Dog Food 2KG| 125.5
|Acana Puppy & Junior Medium Breed Dry Puppy Food| 125.5
|Acana Puppy & Junior Medium Breed Dry Puppy Food| 257.75
|Acana Prairie Poultry Medium Breed Adult Dry Dog Food 9.7KG| 364.0
|Acana Wild Coast Canine Formula Adult Dry Dog Food 2KG| 125.5
|Orijen Fit & Trim Adult Dry Dog Food| 144.75
|Orijen Fit & Trim Adult Dry Dog Food| 510.75
|Acana Large Breed Dry Puppy Food 11.4KG| 424.5
|Orijen Six Fish Adult Dry Dog Food| 536.0
|Orijen Six Fish Adult Dry Dog Food| 157.5
|Orijen Six Fish Adult Dry Dog Food| 348.5
|Orijen Original Adult Dry Dog Food| 144.75
|Orijen Original Adult Dry Dog Food| 510.75
|Orijen Original Adult Dry Dog Food| 287.0
|Orijen Puppy All Breed Dry Dog Food| 510.75
|Orijen Puppy All Breed Dry Dog Food| 287.0
|Orijen Puppy All Breed Dry Dog Food| 144.75
|Orijen Large Breed Puppy Dry Food| 510.75
|Orijen Large Breed Puppy Dry Food| 222.75
|ZIWI Peak Air Dried Free Range Dog Dry Food| 188.25
|ZIWI Peak Air Dried Free Range Dog Dry Food| 672.5
|ZIWI Peak Air Dried Free Range Dog Dry Food| 418.75
|Acana Pacifica Dry Cat & Kitten Food| 298.0
|Acana Pacifica Dry Cat & Kitten Food| 135.0
|Orijen Fit & Trim Dry Cat Food 1.8KG| 163.0
|Applaws Chicken & Duck Adult Dry Cat Food 2KG| 103.5
|Applaws Chicken & Salmon Adult Dry Cat Food 2KG| 103.5
|Applaws Chicken Adult Dry Cat Food 2KG| 103.5
|Applaws Kitten Grain Free Dry Food 2KG| 103.5
|Thrive PremiumPlus Grain Free Chicken Dry Cat Food 1.5KG| 86.75
|Thrive PremiumPlus Grain Free Salmon & Herring Dry Cat Food 1.5KG| 86.75
|Thrive PremiumPlus Grain Free Chicken With Turkey Dry Cat Food 1.5KG| 86.75
|Orijen Six Fish Formula Grain Free Diet Dry Cat Food| 324.0
|Orijen Six Fish Formula Grain Free Diet Dry Cat Food| 177.25
|Orijen Cat & Kitten Dry Food| 295.0
|Orijen Cat & Kitten Dry Food| 140.0
|Thrive ProReward Chicken Dog Treats 60G| 26.25
|Thrive ProReward Duck Dog Treats 60G| 26.25
|Applaws Tuna & Prawn Adult Wet Cat Food 156G| 12.75
|Applaws Ocean Fish Wet Cat Food 156G| 12.75
|Applaws Chicken Breast Wet Cat Food 156G| 12.75
|Applaws Chicken Breast with Beef in Jelly Wet Cat Food 70G| 10.0
|Applaws Chicken Breast with Liver in Jelly Wet Cat Food 70G| 10.0
|Applaws Chicken Breast with Wild Rice Wet Cat Food 70G| 10.0
|Applaws Chicken with Pumpkin Wet Cat Food 70G| 10.0
|Applaws Chicken & Duck Cat Wet Food 60G| 8.0
|Applaws Fish Selection Pack Wet Cat Food 8X60G| 54.0
|Applaws Chicken for Kittens Wet Food 70G| 7.5
|Applaws Natural Tuna Fillet Wet Cat Food 156G| 12.75
|Applaws Tuna Fillet With Anchovy Wet Cat Food 70G| 10.0
|Applaws Tuna Fillet with Pacific Prawn Wet Cat Food 70G| 10.0
|Applaws Tuna Fillet with Pacific Prawn Wet Cat Food 70G| 120.0
|Applaws Tuna Fillet With Sea Bream Wet Cat Food 70G| 10.0
|Applaws Natural Tuna & Prawn Wet Cat Food 60G| 7.75
|Applaws Tuna for Kittens Wet Food 70G| 7.5
|Applaws Natural Chicken & Duck Wet Cat Food 156G| 12.75
|Thrive Complete Chicken Breast Wet Cat Food 75G| 8.0
|Thrive Complete Ocean Fish Wet Cat Food 75G| 8.0
|Thrive Complete Tuna Wet Cat Food 75G| 8.0
|Applaws Natural Tuna Fillet with Seaweed Wet Cat Food 156G| 12.75
|Thrive Complete Chicken Breast & Chicken Liver Wet Cat Food 75G| 8.0
|Thrive Complete Chicken Breast with Turkey Wet Cat Food 75G| 8.0
|Thrive Complete Tuna & Salmon Wet Cat Food 75G| 8.0
|Thrive Complete Sardine With Mackerel Wet Cat Food 75G| 8.0
|Thrive Complete Cat Tuna with Shrimp & Squid Wet Cat Food 75G| 8.0
|Applaws Natural Tuna & Cheese Wet Cat Food 156G| 12.75
|Thrive 100% Real Freeze Dried Chicken Cat Treats| 173.25
|Thrive 100% Real Freeze Dried Chicken Cat Treats| 34.75
|Thrive 100% Real Freeze Dried Tuna Cat Treats| 157.5
|Thrive 100% Real Freeze Dried Tuna Cat Treats| 34.75
|Thrive 100% Real Freeze Dried White Fish Cat Treats| 157.5
|Thrive 100% Real Freeze Dried White Fish Cat Treats| 34.75
|Happy Dog Africa Dry Dog Food| 416.0
|Happy Dog Africa Dry Dog Food| 152.0
|Happy Dog My Little Irland Dry Dog Food 4KG| 116.8
|Happy Dog Toscana Dry Dog Food 4KG| 136.0
|Happy Dog NaturCroq Adult Lamb & Rice Dry Dog Food 4KG| 120.0
|Happy Dog NaturCroq Adult Beef & Rice Dry Dog Food| 120.0
|Happy Dog NaturCroq Adult Beef & Rice Dry Dog Food| 280.0
|Happy Dog Sensible Montana Dry Dog Food| 44.8
|Happy Dog Sensible Montana Dry Dog Food| 152.0
|Happy Cat Minkas Hairball Control Dry Cat Food| 43.2
|Happy Cat Minkas Hairball Control Dry Cat Food| 208.0
|Happy Cat Minkas Hairball Control Dry Cat Food| 84.0
|Happy Cat Minkas Hairball Control Dry Cat Food| 18.0
|Happy Cat Minkas Perfect Mix Dry Cat Food| 43.2
|Happy Cat Minkas Perfect Mix Dry Cat Food| 208.0
|Happy Cat Minkas Perfect Mix Dry Cat Food| 84.0
|Happy Cat Minkas Perfect Mix Dry Cat Food| 20.8
|Padovan Snack Premium Chicken & Calcium Bones Dog Treats 100G| 25.0
|Padovan Snack Premium Chicken Chips Dog Treats 100G| 25.0
|Padovan Snack Premium Chicken Fillet Dog Treats 100G| 25.0
|Duvo+ Filled Beef Bone with Chicken Dog Chew 330G| 29.0
|Duvo+ Filled Beef Bone with Lamb Dog Chew 330G| 29.0
|Happy Dog Pure Lamb Wet Dog Food 400G| 16.8
|Happy Dog Pure Buffalo Wet Dog Food 400G| 16.8
|Happy Dog Pure Duck Wet Dog Food 400G| 16.8
|Happy Dog Pure Rind Beef Wet Dog Food 400G| 16.8
|Happy Dog Pure Turkey Wet Dog Food 400G| 16.8
|Schesir Chicken Fillets with Beef in Jelly Wet Dog Food 150G| 12.0
|Schesir Chicken Fillets in Jelly Wet Dog Food 150G| 12.0
|Schesir Chicken with Carrots Wet Dog Food 285G| 20.0
|Schesir Chicken with Potatoes Wet Dog Food 285G| 16.0
|Schesir Chicken with Pumpkins Wet Dog Food 285G| 18.0
|Schesir Tuna in Jelly Wet Cat Food 85G| 9.0
|Schesir Tuna & Chicken in Jelly Wet Cat Food 85G| 9.0
|Schesir Chicken Fillet in Jelly Wet Cat Food 85G| 9.0
|Schesir Chicken with Aloe in Jelly Kitten Wet Food 85G| 9.0
|Schesir Tuna with Beef in Jelly Wet Cat Food 85G| 9.0
|Schesir Tuna with Algae in Jelly Wet Cat Food 85G| 9.0
|Schesir Bio Organic Beef Adult Cat Wet Food 85G| 9.0
|Schesir Bio Organic Beef & Chicken with Carrots Sterilized Cat Wet Food 85G| 9.0
|Schesir Natural Brine Chicken Adult Wet Cat Food 85G| 9.0
|Schesir Natural Brine Salmon Wet Cat Food 85G| 9.0
|Schesir Tuna with Shrimp Adult Wet Cat Food 70G| 9.0
|Schesir Tuna with Sardines Adult Wet Cat Food 70G| 9.0
|Schesir Multipack Tuna Wet Cat Food 6X50G| 34.0
|Schesir Tuna & Prawns Cat Multipack Adult Wet Cat Food 6X50G| 34.0
|Schesir Chicken & Duck Multipack Adult Wet Cat Food 6X50G| 34.0
|Schesir Tuna & Salmon Cat Multipack Adult Wet Cat Food 6X50G| 34.0
|Schesir Wild Tuna & Squids Soup Wet Cat Food 85G| 9.0
|Schesir Wild Tuna & Pumpkin Soup Wet Cat Food 85G| 9.0
|Schesir Jelly Tuna with Prawns Adult Wet Cat Food 85G| 9.0
|Padovan Criceti GrandMix Hamster Food 1KG| 23.0
|Padovan Cavie GrandMix Guinea Pig & Chinchilla Small Pet Food 850G| 25.0
|Padovan Wellness Young Dwarf Rabbit Food 1KG| 37.0
|Padovan Coniglietti Grandmix Adult Rabbit Food 3KG| 52.0
|Padovan NaturalMix Canaries Bird Food 5KG| 88.0
|Padovan Wellness Tropical Finches Bird Food 1KG| 37.0
|Padovan NaturalMix Esotici Bird Food 5KG| 68.0
|Padovan NaturalMix Tortore Bird Food 5KG| 37.0
|Padovan Medium Sun Seeds Small Pet & Bird Treats 500G| 11.0
|Duvo+ Dried Meal Worms 200G| 55.0
|PADO Dried Meal Worms Treat for Birds 200G| 31.0
|Padovan Shrimp for Reptiles 160G/1L| 56.0
|Padovan Fieno-Hay Small Pet Food 1KG| 25.0
|PADO Yellow Millet Spray for Birds 250G| 16.8
|Padovan Medium Sun Seeds Food for Birds & Small Pet 5KG| 106.0
|Padovan Stix Sweet Canaries Bird Treat 80G| 16.0
|Padovan NaturalMix Parrocchetti Small & Medium Parrot Food 4.5KG| 61.0
|Padovan GrandMix Cocorite Small Parrot Food 1KG| 21.0
|Padovan GrandMix Esotici Small Exotic Bird Food 1KG| 23.0
|Padovan GrandMix Parrocchetti Bird Food 850G| 23.0
|Padovan Stix Sweet Parakeet and Small Bird Treat 80G| 15.0
|Padovan Stix Parrot Treat 150G| 28.0
|Padovan Stix Fruit Parakeet Treat 100G| 18.0
|Padovan Wellness Canaries Bird Food 1KG| 38.0
|Padovan Wellness Budgies Bird Food 1KG| 34.0
|Padovan Wellness Lovebirds Bird Food 850G| 34.0
|Padovan Wellness Mix Seeds Parrot Food| 38.0
|Padovan Wellness Mix Seeds Parrot Food| 95.0
|Padovan NaturalMix Cocorite Small Bird Food 5KG| 55.0
|Padovan GrandMix Canarini Food for Canaries 1KG| 27.0
|Hill's Science Plan Small & Mini Puppy Dry Food with Chicken| 170.1
|Hill's Science Plan Small & Mini Puppy Dry Food with Chicken| 93.0
|Hill's Science Plan Small & Mini Puppy Dry Food with Chicken| 26.5
|Hill's Science Plan Small & Mini Puppy Dry Food with Chicken| 249.7
|Hill's Science Plan Medium Puppy Food with Lamb & Rice| 140.2
|Hill's Science Plan Medium Puppy Food with Lamb & Rice| 417.0
|Hill's Science Plan Medium Puppy Food with Lamb & Rice| 482.7
|Hill's Science Plan Small & Mini Adult Chicken Dry Dog Food| 93.0
|Hill's Science Plan Small & Mini Adult Chicken Dry Dog Food| 156.0
|Hill's Science Plan Small & Mini Adult Chicken Dry Dog Food| 342.6
|Hill's Science Plan Medium Adult with Lamb & Rice| 132.3
|Hill's Science Plan Medium Adult with Lamb & Rice| 455.3
|Hill's Science Plan Medium Puppy Food with Chicken| 45.7
|Hill's Science Plan Medium Puppy Food with Chicken| 133.9
|Hill's Science Plan Medium Puppy Food with Chicken| 514.7
|Hill's Science Plan Medium Puppy Food with Chicken| 413.0
|Hill's Science Plan Small & Mini Mature Chicken Adult 7+ Dry Dog Food 3KG| 159.1
|Hill's Science Plan Medium Adult Dog Food| 115.0
|Hill's Science Plan Medium Adult Dog Food| 400.5
|Hill's Science Plan Sensitive Stomach & Skin Medium Adult Dry Dog Food| 149.7
|Hill's Science Plan Sensitive Stomach & Skin Medium Adult Dry Dog Food| 485.7
|Hill's Science Plan Sensitive Stomach & Skin Chicken Adult Dry Cat Food| 137.1
|Hill's Science Plan Sensitive Stomach & Skin Chicken Adult Dry Cat Food| 388.0
|Hill's Science Plan Hairball Indoor Adult Dry Cat Food| 132.0
|Hill's Science Plan Hairball Indoor Adult Dry Cat Food| 233.2
|Hill's Science Plan Hairball Indoor Adult Dry Cat Food| 29.0
|Hill's Science Plan Feline Young Adult Sterilised with Chicken 1.5KG| 124.0
|Hill's Science Plan Kitten with Chicken Dry Food| 37.8
|Hill's Science Plan Kitten with Chicken Dry Food| 113.4
|Hill's Science Plan Kitten with Chicken Dry Food| 204.8
|Hill's Science Plan Kitten with Chicken Dry Food| 347.2
|Hill's Science Plan Kitten with Tuna Dry Food 1.5KG| 113.4
|Hill's Science Plan Chicken Adult Dry Cat Food| 33.1
|Hill's Science Plan Chicken Adult Dry Cat Food| 111.9
|Hill's Science Plan Chicken Adult Dry Cat Food| 187.5
|Hill's Science Plan Chicken Adult Dry Cat Food| 581.6
|Hill's Science Plan Chicken Adult Dry Cat Food| 427.9
|Hill's Science Plan Tuna Adult Dry Cat Food| 111.9
|Hill's Science Plan Tuna Adult Dry Cat Food| 187.5
|Hill's Science Plan Savoury Chicken Wet Puppy Food 370G| 19.1
|Hill's Science Plan Canine Adult Savoury with Chicken Wet Dog Food 370G| 19.1
|PURINA Pro Plan Light/Sterilised with Optiweight Chicken Adult Dry Dog Food| 154.35
|PURINA Pro Plan Light/Sterilised with Optiweight Chicken Adult Dry Dog Food| 410.55
|PURINA Pro Plan Optibalance Chicken Medium Adult Dry Dog Food| 143.85
|PURINA Pro Plan Optibalance Chicken Medium Adult Dry Dog Food| 359.1
|PURINA Pro Plan Large Athletic Everyday Nutrition Chicken Dry Dog Food 14KG| 359.1
|PURINA Pro Plan Optibalance Chicken Large Robust Adult Dry Dog Food 14KG| 359.1
|PURINA Pro Plan Optistart Chicken Large Athletic Puppy Dry Food| 128.1
|PURINA Pro Plan Optistart Chicken Large Athletic Puppy Dry Food| 342.3
|PURINA Pro Plan Optistart Chicken Large Robust Puppy Dry Food| 128.1
|PURINA Pro Plan Optistart Chicken Large Robust Puppy Dry Food| 323.4
|PURINA Pro Plan Optistart Chicken for Medium Puppy Dry Food| 122.85
|PURINA Pro Plan Optistart Chicken for Medium Puppy Dry Food| 328.65
|PURINA Pro Plan Optistart Chicken Small & Mini Puppy Dry Food 3KG| 138.6
|PURINA Pro Plan Optibalance Small & Mini Adult Dry Dog Food 3KG| 143.85
|PURINA Pro Plan Optidigest Sensitive Digestion Small & Mini Adult Dry Dog Food 3KG| 149.1
|PURINA Pro Plan Optidigest Medium Sensitive Lamb Adult Dry Dog Food| 155.4
|PURINA Pro Plan Optidigest Medium Sensitive Lamb Adult Dry Dog Food| 410.55
|PURINA Pro Plan Optiderma Salmon Medium Sensitive Skin Adult Dry Dog Food| 143.0
|PURINA Pro Plan Optiderma Salmon Medium Sensitive Skin Adult Dry Dog Food| 513.45
|PURINA Pro Plan Optiderma with Salmon Small & Mini Sensitive Skin Puppy Dry Food 3KG| 149.1
|PURINA Pro Plan Delicate Optidigest Turkey Adult Dry Cat Food| 97.65
|PURINA Pro Plan Delicate Optidigest Turkey Adult Dry Cat Food| 564.9
|PURINA Pro Plan Derma Care Salmon Adult Dry Cat Food 1.5KG| 97.65
|PURINA Pro Plan Adult Renal Plus Chicken Dry Cat Food 1.5KG| 92.4
|PURINA Pro Plan Vital Functions Adult Dry Cat Food 1.5KG| 92.4
|PURINA Pro Plan Original Healthy Start Dry Kitten Food| 87.15
|PURINA Pro Plan Original Healthy Start Dry Kitten Food| 421.05
|PURINA Pro Plan Original Healthy Start Dry Kitten Food| 23.1
|PURINA Pro Plan Sterilised Optidigest Adult Chicken Dry Cat Food| 92.4
|PURINA Pro Plan Sterilised Optidigest Adult Chicken Dry Cat Food| 456.75
