|Miratorg EXTRA MEAT with Chicken in Sauce for Sterilised Cat Wet Food 80g| 3.99
|Miratorg EXTRA MEAT with Chicken in Sauce for Sterilised Cat Wet Food 80g| 95.76
|Miratorg EXTRA MEAT with Veal in Jelly for Sensitive Digestion Cat Wet Food 80g| 3.99
|Miratorg EXTRA MEAT with Veal in Jelly for Sensitive Digestion Cat Wet Food 80g| 95.76
|Miratorg MEAT with Juicy Beef for Medium and Large Breed Dog Dry Food| 34.9
|Miratorg MEAT with Juicy Beef for Medium and Large Breed Dog Dry Food| 259.9
|Miratorg MEAT with Tender Veal for All Breed Cat Dry Food| 10.9
|Miratorg MEAT with Tender Veal for All Breed Cat Dry Food| 24.9
|Vitalin Chicken with Veg & Thyme Dog Dry Food| 99.0
|Vitalin Chicken with Veg & Thyme Dog Dry Food| 399.0
|Vitalin Chicken With Veg & Thyme Puppy Dry Food| 119.0
|Vitalin Chicken With Veg & Thyme Puppy Dry Food| 499.0
|Vitalin Farmhouse Chicken Dog Dry Food| 99.0
|Vitalin Farmhouse Chicken Dog Dry Food| 399.0
|Vitalin Farmhouse Supper with Beef and Veg Dog Dry Food| 99.0
|Vitalin Farmhouse Supper with Beef and Veg Dog Dry Food| 399.0
|Vitalin Lamb & Mint Dog Dry Food| 119.0
|Vitalin Lamb & Mint Dog Dry Food| 499.0
|Vitalin Pork with Apple Dog Dry Food| 99.0
|Vitalin Pork with Apple Dog Dry Food| 399.0
|Vitalin Small Breed Lamb & Mint Dog Dry Food 2KG| 119.0
|Vitalin Small Breed Chicken Veg & Thyme Dog Dry Food 2KG| 99.0
|Wanpy Chicken Jerky Steaks Dog Treats 100G| 21.0
|Wanpy Chicken Jerky Bars Dog Treats 100G| 21.0
|Wanpy Soft Chicken Jerky Strips Dog Treats 100G| 21.0
|Wanpy Chicken Jerky Chips Dog Treats 100G| 21.0
|Wanpy Soft Chicken Jerky Cheese Slices Dog Treats 100G| 21.0
|Wanpy Chicken Jerky and Codfish Sandwiches Dog Treats 100G| 15.75
|Wanpy Chicken Jerky and Codfish Sushi Dog Treats| 15.75
|Wanpy Chicken Jerky Dumbbells Dog Treats 100G| 21.0
|Wanpy Chicken Jerky and Calcium Bone Wrap Dog Treats 100G| 21.0
|Wanpy Duck Jerky Dog Treats 100G| 21.0
|Wanpy Soft Duck Jerky Strips Dog Treats 100G| 21.0
|Wanpy Soft Duck Fillets Dog Treats 100G| 21.0
|Wanpy Soft Lamb Jerky Slices Dog Treats 100G| 21.0
|Wanpy Soft Beef Jerky Slices Dog Treats 100G| 21.0
|Wanpy Dry Venison Jerky Dog Treats 100G| 21.0
|Wanpy Duck Jerky Dumbbells Dog Treats 100G| 21.0
|Wanpy Chicken Skewers Dog Treats 100G| 21.0
|Wanpy Salmon Sticks Dog Treats 100G| 21.0
|Wanpy Grilled Beef Steaks Dog Treats 100G| 21.0
|Wanpy Marbled Beef Bites Dog Treats 100G| 17.85
|Hill's Science Plan Kitten with Chicken Dry Food Promo Box| 109.0
|Harringtons Complete Chicken Adult Dry Cat Food 2KG| 53.75
|Harringtons Complete Chicken Indoor Dry Cat Food| 53.75
|Harringtons Fish in Jelly Wet Cat Food 12X85G| 40.25
|Harringtons Meat in Jelly Wet Cat Food| 40.25
|Harringtons Complete Puppy Turkey & Rice Dry Food| 40.0
|Harringtons Complete Puppy Turkey & Rice Dry Food| 190.0
|Harringtons Complete Beef Adult Dry Dog Food| 40.0
|Harringtons Complete Beef Adult Dry Dog Food| 91.5
|Harringtons Complete Chicken Adult Dry Dog Food| 40.0
|Harringtons Complete Chicken Adult Dry Dog Food| 91.5
|Harringtons Complete Lamb Rice Adult Dry Dog Food| 40.0
|Harringtons Complete Lamb Rice Adult Dry Dog Food| 91.5
|Harringtons Complete Lamb Rice Adult Dry Dog Food| 260.0
|Harringtons Complete Salmon & Potato Dry Dog Food| 40.0
|Harringtons Complete Salmon & Potato Dry Dog Food| 220.5
|Harringtons Complete Turkey Veg Adult Dry Dog Food| 40.0
|Harringtons Complete Turkey Veg Adult Dry Dog Food| 91.5
|Harringtons Complete Turkey Veg Adult Dry Dog Food| 260.0
|Harringtons Complete Chicken Rice Senior Dry Food| 220.5
|Harringtons Chicken & Potato Puppy Wet Food| 11.25
|Harringtons Chicken Wet Dog Food 400G| 11.25
|Harringtons Duck Wet Dog Food 400G| 11.25
|Harringtons Salmon Wet Dog Food 400G| 11.25
|Harringtons Turkey Wet Dog Food 400G| 11.25
|Arden Grange Grain Free Adult Duck & Superfoods Dry Dog Food| 114.9
|Arden Grange Grain Free Adult Duck & Superfoods Dry Dog Food| 499.0
|Arden Grange Grain Free Adult Turkey & Superfoods Dry Dog Food| 114.9
|Arden Grange Grain Free Adult Turkey & Superfoods Dry Dog Food| 499.0
|Arden Grange Grain Free Duck & Superfoods Training Treats for Dogs| 15.0
|Lily's Kitchen Dog Pasta Al Ragu Wet Dog Food| 20.9
|Lily's Kitchen Dog Pasta Al Ragu Wet Dog Food| 125.4
|Lily's Kitchen Dog Classic Multipack Wet Dog Food 6x400g| 109.0
|Lily's Kitchen Dog Springtime Stew Tray Wet Dog Food| 12.9
|Lily's Kitchen Dog Springtime Stew Tray Wet Dog Food| 129.0
|NT Labs Pro-f Axolotl Adult Pellet 165g| 69.0
|Hill's Science Plan Hypoallergenic Small & Mini Adult Dry Dog Food With Salmon 1.5KG| 116.6
|NT Labs Pro-f Fish Treats 40G| 39.0
|Hill's Science Plan Hypoallergenic Large Breed Adult Dry Dog Food With Salmon 12KG| 501.1
|ZIWI Peak Mackerel & Lamb Recipe Wet Dog Food 170G| 15.0
|Farmina Lamb&Blueberry Adult Medium&Maxi Dog Dry Food 2.5KG| 148.0
|Farmina Lamb&Blueberry Adult Mini Dog Dry Food 2.5KG| 148.0
|Farmina N&D Chicken&Pomegrante Adult Mini Dog Dry Food 2.5KG| 152.0
|Farmina N&D Ocean Herring&Orange Adult Medium&Maxi Dog Dry Food 2.5KG| 154.0
|Farmina N&D Ocean Herring&Orange Adult Mini Dog Dry Food 2.5KG| 154.0
|Farmina N&D Prime Chicken&Pomegrante Puppy Medium&Maxi Dry Food 2.5KG| 148.0
|Farmina N&D Pumpkin Chicken&Pomegranate Adult Medium&Maxi Dog Dry Food 2.5KG| 154.0
|Farmina N&D Pumpkin Chicken&Pomegranate Adult Mini Dog Dry Food 2.5KG| 154.0
|Farmina N&D Pumpkin with Cod&Orange Adult Medium&Maxi Dog Dry Food 2.5KG| 160.0
|Friskies Kitten Discoveries Cat Dry Food| 10.0
|Friskies Kitten Discoveries Cat Dry Food| 24.0
|Farmina Quinoa with Venison Skin & Coat Dry Dog Food 2.5KG| 170.0
|Friskies Meaty Grill Cat Dry Food 1KG| 25.0
|Friskies Seafood Sensations Cat Dry Food| 10.0
|Friskies Seafood Sensations Cat Dry Food| 24.0
|Friskies Seafood Sensations Cat Dry Food| 60.0
|Friskies Seafood Sensations Cat Dry Food| 140.0
|Friskies Surfin Favourites Cat Dry Food| 10.0
|Friskies Surfin Favourites Cat Dry Food| 24.0
|Friskies Surfin Favourites Cat Dry Food| 140.0
|PURINA Fancy Feast Gravy Lover Ocean Whitefish & Tuna Wet Cat Food 85G| 6.5
|PURINA Fancy Feast Grilled Liver & Chicken Wet Cat Food 85G| 6.5
|PURINA Fancy Feast Grilled Salmon Wet Cat Food 85G| 6.5
|PURINA Felix as Good as it Looks Tuna in Jelly Pouch Wet Cat Food 12X85G| 39.0
|PURINA Felix Party Mix Classic Mix Cat Treats 60G| 7.9
|PURINA Felix Party Mix Seafood Mix Cat Treats 60G| 7.9
|Purina Felix Play Tubes Chicken and Liver Cat Treats 50G| 6.9
|Purina Felix Play Tubes Tuna and Crab Cat Treats 50G| 6.9
|Friskies Indoor Delights Cat Dry Food 1KG| 24.0
|Expiry Date 30-Apr-25 PURINA Pro Plan Opti Age Medium & Large Adult 7+ Chicken Dog Dry Food 3kg| 102.0
|Hill's Science Plan Kitten & Mother Tender Mousse Wet Food 85G| 9.12
|Hill's Science Plan Hypoallergenic Dog Treat 220g| 44.0
|Happy Cat Minkas Junior Care Dry Food| 19.5
|Happy Cat Minkas Junior Care Dry Food| 39.0
|Happy Cat Minkas Junior Care Dry Food| 189.0
|Happy Cat Minkas Duo Beef & Rabbit Wet Cat Food| 6.0
|Happy Dog Sensible Mini Neuseeland Dry Food| 128.0
|Happy Dog Fit & Vital Mini Adult Dry Food| 35.7
|Happy Dog Fit & Vital Mini Adult Dry Food| 112.0
|Happy Dog Fit & Vital Mini Adult Dry Food| 251.0
|Happy Dog Fit & Vital Puppy 4KG| 108.8
|Happy Dog Sensible Puppy Lachs & Kartoffel| 144.0
|Happy Dog Soft Snack Ireland Treats 100G| 20.0
|Happy Dog NaturCroq Junior Dry Food| 105.0
|Himalayan Barkeetos Cheese Dog Treats 85G| 22.05
|Himalayan Peanut Butter Cookies Dog Treats 396g| 50.4
|Himalayan Chicken Pot Pie Cookies Dog Treats 396g| 50.4
|Himalayan Carrot Cake Cookies Dog Treats 396g| 50.4
|Himalayan Bacon Bites Dog Cookies Dog Treats 396g| 50.4
|Himalayan Unhide Rawhide Free Chew Dog Treats| 33.6
|Himalayan Unhide Rawhide Free Chew Dog Treats| 50.4
|Himalayan Unhide Rawhide Free Chew Dog Treats| 70.35
|Himalayan Dog Chew Cheese Treats| 50.4
|Himalayan Dog Chew Cheese Treats| 42.0
|Himalayan Dog Chew Cheese Treats| 50.4
|Himalayan Churro Cheese Dog Chew Treats 113.3g| 33.6
|Himalayan Churro Chicken Dog Chew Treats 113.3g| 33.6
|Himalayan Churro Bacon Dog Chew Treats 113.3g| 33.6
|Himalayan Churro Peanut Butter Dog Chew Treats 113.3g| 33.6
|Himalayan Yogurt Sticks Dog Treats| 36.75
|Himalayan Dog Chew Bacon Dog Treats| 50.4
|Himalayan Dog Chew Bacon Dog Treats| 42.0
|Himalayan Dog Chew Bacon Dog Treats| 50.4
|Himalayan Yogurt Sticks Peanut Butter Dog Treats 136g| 36.75
|Himalayan Yogurt Sticks Bacon Dog Treats 136g| 36.75
|Himalayan Dog Chew Peanut Butter Dog Treats| 50.4
|Himalayan Dog Chew Peanut Butter Dog Treats| 50.4
|PURINA Fancy Feast Chicken Classic Pate Wet Cat Food 85G| 6.5
|PURINA Fancy Feast Beef & Chicken Classic Pate Wet Cat Food 85G| 6.5
|PURINA Fancy Feast Chicken & Liver Classic Pate Wet Cat Food 85G| 6.5
|PURINA ONE Adult Hairball Chicken Wet Food Pouch 70G| 8.5
|Inaba Grilled Chicken Fillet in Chicken Broth Cat Treat 25G| 10.25
|Inaba Churu Chicken Recipe 8 Tubes Dog Treat 160g| 26.25
|Pet Natural Farm 12" Bully Stick Dog Treats| 29.4
|Pet Natural Farm 12" Bully Stick Dog Treats| 47.25
|Pet Natural Farm 12" Bully Stick Dog Treats| 57.75
|Pet Natural Farm 12" Bully Stick Dog Treats| 68.25
|Pet Natural Farm 12" Bully Stick Dog Treats| 84.0
|Pet Natural Farm 6" Bully Stick Dog Treats| 17.0
|Pet Natural Farm 6" Bully Stick Dog Treats| 26.25
|Pet Natural Farm 6" Bully Stick Dog Treats| 36.75
|Pet Natural Farm 6" Bully Stick Dog Treats| 47.25
|Pet Natural Farm 6" Bully Stick Dog Treats| 57.75
|Pet Natural Farm Beef Ear Dog Treats| 15.75
|Pet Natural Farm Beef Ear Dog Treats| 68.25
|Pet Natural Farm Beef Tendon Dog Treats 1PC| 42.0
|Pet Natural Farm Beef Trachea Dog Treats 1PC| 15.75
|Pet Natural Farm Beef Dog Treats| 33.6
|Pet Natural Farm Beef Dog Treats| 141.75
|Pet Natural Farm Lamb Ear Dog Treats 1PC| 9.45
|Pet Natural Farm Lamb Lungs Dog Treats 100G| 33.6
|Pet Natural Farm 12" Beef Tail Dog Treats| 36.75
|Pet Natural Farm 12" Beef Tail Dog Treats| 47.25
|Pet Natural Farm 12" Beef Tail Dog Treats| 57.75
|Pet Natural Farm 12" Beef Tail Dog Treats| 68.25
|Pet Natural Farm 6" Beef Tail Dog Treats| 15.75
|Pet Natural Farm 6" Beef Tail Dog Treats| 21.0
|Pet Natural Farm 6" Beef Tail Dog Treats| 26.25
|Pet Natural Farm 6" Beef Tail Dog Treats| 31.5
|Hill's Science Plan Puppy & Mother Mousse Dog Wet Food 200G| 13.3
|Beaphar Quick Clean for Dogs 250ml| 55.0
|Lintbells YuCalm Triple-Action Calming Tablets for Dogs| 122.5
|Lintbells YuCalm Triple-Action Calming Tablets for Dogs| 227.5
|Beaphar Plaque Away Mouth Wash for Dogs & Cats 250ml| 51.0
|Beaphar Puppy Dental Kit for Puppies 50g| 47.0
|Beaphar Salmon Oil for Dogs & Cats 430ml| 58.5
|Beaphar Toothpaste for Dogs & Cats 100g| 36.0
|Beaphar Top 10 Multi Vitamin Supplement for Dog 180 tablets| 48.5
|pet remedy Natural De-Stress & Calming Spray for Pets| 39.0
|pet remedy Natural De-Stress & Calming Spray for Pets| 110.5
|pet remedy Natural De-Stress & Calming Plug-In Diffuser for Pets 40ml| 126.0
|Lintbells YuMOVE Joint Care Supplement for Dogs| 251.0
|Lintbells YuMOVE Joint Care Supplement for Dogs| 544.5
|Lintbells YuMOVE Joint Care Supplement for Dogs| 142.0
|Lintbells YuMOVE Active Dog Joint Care Supplement 60 tablets| 162.5
|Lintbells YuMOVE Skin & Coat Care Itching for Dogs 250ml| 160.5
|Lintbells YuMOVE Skin & Coat Care Itching for Dogs 250ml| 242.5
|Beaphar Calming Dog Collar 65cm| 43.0
|Vetafarm SYNBIOTIC 180-S for Optimum Immune System and Digestive Support for Pets 150g| 93.0
|Buster DogMaze Mini Slow Feeding Bowl 32x27x5cm| 159.0
|Armitage Good Boy Wild Tugs Dino Toy for Dogs 40cm| 49.5
|Armitage Good Boy Wild Tugs Lizard Toy for Dogs 46cm| 49.5
|all for paws Interactive MAXI Hyper Fetch Toy for Dogs 27x21x26cm| 701.0
|all for paws Hyper Fetch Balls Toy for Dogs 4cm| 43.0
|all for paws Ultrasonic Sky Gator Toy for Dogs| 43.0
|all for paws Ultrasonic Ostrich Toy for Dogs 28.5cm| 41.0
|all for paws Ultrasonic Donkey King Toy for Dogs 38.5cm| 42.0
|all for paws Ultrasonic Ghz Giraf Toy for Dogs 23.5cm| 38.0
|all for paws Little Buddy Blanky Elephant Toy for Dogs 10x34x40cm| 43.5
|all for paws Little Buddy Comforting Bunny Toy for Dogs 4x25x35cm| 43.5
|all for paws Little Buddy Crinkly Lelesea Toy for Dogs 10x12.6x18cm| 34.0
|all for paws Little Buddy Goofy Elephant Toy for Dogs 12x17x26cm| 41.0
|all for paws Little Buddy Kookoo Bird Toy for Dogs 8x14x25cm| 34.0
|all for paws Treat Hider Squirrel Toy for Dogs 4.5x8x12cm| 38.0
|all for paws Treat Hider Dog Toy for Dogs 9x16x18cm| 41.0
|all for paws Rooster Body Treat Hider Toy for Dogs 20cm| 44.5
|Pioneer Pet Ceramic Raindrop Fountain for Dogs & Cats 1.8L| 314.0
|Pioneer Pet Stainless Steel Raindrop Fountainfor Dogs & Cats 1.8L| 335.0
|Pioneer Pet Filters for Ceramic and Stainless Steel Fountains| 37.0
|Pioneer Pet Filters for Plastic/Stainless Steel Fountains| 20.0
|Pioneer Pet Cleaning Brush For Fountains 1.75"x1.75"x10.5"| 21.0
|pet remedy Natural De-Stress & Calming Atomiser for Pets 250ml| 220.5
|Beaphar Playspray for Cat 150ml| 43.5
|pet remedy Natural De-Stress & Calming Atomiser Refill for Pets 250ml| 136.5
|Fauna Madena Cat Pole 78cm| 318.0
|Fauna Vitor Cat Post 125cm| 381.5
|PetLove Jingle Balls Cat Toy 5cm| 18.0
|Catit Senses 2.0 Digger Smart Slow Feeder for Cats 14.5x24x24.5cm| 63.0
|Catit Senses 2.0 Food Tree for Cats 27x35x31cm| 101.0
|Catit Senses 2.0 Multi Feeder for Cats| 42.0
|Catit Senses 2.0 Super Play Circuit for Cats 26.67x26.67x7.62cm| 63.0
|Catit Senses 2.0 Super Circuit for Cats 61x36.5x5.3cm| 106.0
|all for paws Flutter Bug Toy for Cats 25x25x8cm| 89.5
|all for paws Interactive Treat Dispenser Toy for Cats 45x6.5x9.5cm| 42.0
|Beaphar Indoor Behaviour Spray for Cats 125ml| 45.5
|Lindocat LindoCip Bird Litter 1kg| 23.5
|Beaphar Vitamin B Coat & Skin Supplement for Pets 50ml| 38.0
|Beaphar Multi-Vit Rabbit & Rodents Supplement 20ml| 37.0
|Beaphar Chinchilla Bathing Sand 2L| 42.0
|Zolux Rody 3 Trio Rodent Cage for Small Pets 53x27x41cm| 392.5
|Zolux Rody 3 Duo Rodent Cage for Small Pets 40.5x27x41cm| 320.0
|Zolux Rody 3 Solo Rodent Cage for Small Pets 28x27x41cm| 259.5
|Beaphar Wound Ointment for Pets 30ml| 42.0
|Beaphar Ear Cleaner for Dogs & Cats 50ml| 44.0
|Beaphar Eye Cleaner for Dogs & Cats 50ml| 44.5
|Beaphar Tear Stain Remover for Dogs & Cats 50ml| 43.0
|Catit Senses 2.0 Self Groomer for Cats 13cm| 21.0
|Beaphar Papick Spray for Bird Feather Plucking 200ml| 64.0
|Beaphar Top 10 Multi Vitamin for Cat 180 tablets| 48.5
|Mikki Supplements Manager for Dogs & Cats 11cm| 24.0
|Beaphar Malt Paste Hairball Remedy for Cats 100G| 41.0
|Beaphar Cat Litter Deodorizer 400g| 38.0
|Catit Flower Fountain for Cats 3L| 136.5
|pet remedy Natural De-Stress & Calming Refill Bottles for Pets 2x40ml| 126.0
|Beaphar Fiprotec Spot-On Flea & Tick Treatment for Dogs| 122.0
|Beaphar Fiprotec Spot-On Flea & Tick Treatment for Dogs| 106.0
|Beaphar Fiprotec Spot-On Flea & Tick Treatment for Dogs| 94.0
|Catit Magic Blue Cartridge for Cat Litter Box 2pcs| 32.0
|Catit Magic Blue Refill Pads for Cat Litter Box 2pcs| 44.0
|Safe4 RTU Trigger Disinfectant Spray 500ml| 35.0
|Safe4 RTU Trigger Disinfectant Spray 500ml| 35.0
|Beaphar Grooming Powder for Cats 150g| 52.5
|Beaphar Fiprotec Spot-On Flea & Tick Treatment for Cats| 84.0
|Beaphar Reptile & Turtle Multi Vitamins 20ml| 34.0
|JBL Micro Calcium for Reptiles 100g| 69.0
|JBL TerraVit Powder for Reptiles 135g| 75.0
|Exo Terra 100 Compact Tropical UVB Heating & Lighting for Reptiles| 121.0
|Exo Terra Leopard Gecko Reptile Starter Kit 45x45x30cm| 1337.0
|Terratlantis Replacement Filter for TC-500 Internal Filter for Terrarium 2pcs| 28.5
|MPS 2 Ambra Bird Cage| 283.5
|MPS 2 Ambra Bird Cage| 257.5
|MPS 2 Kloris Bird Cage 70.5x55.5x100cm| 403.0
|MPS 2 Sophia Bird Cage 67x40x62cm| 230.5
|Zolux Arabesque Leonie Bird Cage 140x49.5x49.5cm| 327.0
|Zolux Arabesque Anna Bird Cage 143x42x62cm| 508.5
|Zolux Neo Jili Bird Cage| 881.0
|Zolux Neo Jili Bird Cage| 741.5
|Zolux Neo Jili Bird Cage| 881.0
|Zolux Bird Nesting Box Duplex 250 25x15x25cm| 162.0
|Zolux Bird Nesting Box Classic| 54.5
|Zolux Bird Nesting Box Classic| 280.5
|Zolux Bird Nesting Box Loft 150 15x15x25cm| 127.0
|Beaphar Multi-Vit Parrots for Birds 20ml| 35.5
|Beaphar Cage Fresh Granules Deodorizer for Small pet 600g| 43.0
|Beaphar Indoor Behaviour Spray for Dogs 125ml| 43.5
|all for paws Travel Pet Ramp Dogs & Cats| 273.0
|Seachem Jurassi Clean Reptile Enclosure Cleaner 250ml| 50.0
|pet remedy Heated Pet Padfor Dogs & Cats 42x38cm| 273.0
|KONG Classic Cone Chew Toy for Dogs| 73.5
|KONG Classic Cone Chew Toy for Dogs| 63.0
|KONG Classic Cone Chew Toy for Dogs| 94.5
|KONG Classic Cone Chew Toy for Dogs| 47.25
|KONG Extreme Chew Toy for Dogs| 78.75
|KONG Extreme Chew Toy for Dogs| 73.5
|KONG Extreme Chew Toy for Dogs| 42.0
|KONG Extreme Chew Toy for Dogs| 115.5
|Beco Poop Bags for Dogs 120pcs| 32.0
|Beco Poop Bags in Dispenser for Dogs 300pcs| 63.0
|KONG Premium Catnip For Cats| 47.25
|KONG Premium Catnip For Cats| 29.75
|Cat's Best Organic Clumping Cat Litter| 56.0
|Cat's Best Organic Clumping Cat Litter| 132.5
|Cat's Best Organic Clumping Cat Litter| 204.75
|Cat's Best Organic Clumping Cat Litter| 66.5
|Synergy Labs Groomer's Salon Select Puppy Shampoo 544ml| 39.0
|Synergy Labs Groomer's Salon Select Oatmeal Conditioner for Dogs 544ml| 39.0
|Synergy Labs Groomer's Salon Select Oatmeal Itch Relief Shampoo for Dogs 544ml| 39.0
|Synergy Labs Groomer's Salon Select Deodorizing Shampoo for Dogs 544ml| 39.0
|Groom Professional Ear Powder for Pets| 72.0
|Bioline Tear Stain Remover Eye Care for Pets 50ml| 21.0
|Synergy Labs Veterinary Formula Clinical Care Ear Therapy for Dogs & Cats 118ml| 50.0
|Groom Professional Ear Wash for Pets 500ml| 79.0
|Padovan Pet Wipes for Dogs & Cats 40pcs| 25.0
|Synergy Labs Dog Wash Oatmeal Itch Relief Shampoo for Dogs 354ml| 42.0
|Synergy Labs Dog Wash Puppy Pure and Simple Shampoo for Puppies 354ml| 42.0
|Synergy Labs Dog Wash 4-in-1 Shampoo for Dogs 354ml| 42.0
|Synergy Labs Dog Wash Ultra White Shampoo for Dogs 354ml| 42.0
|Synergy Labs Dog Wash Oatmeal Itch Relief Conditioner for Dogs 354ml| 42.0
|Synergy Labs Veterinary Formula Clinical Care Antiparasitic & Antiseborrheic Shampoo for Dogs 473ml| 93.0
|Synergy Labs Care Shampoo for Dogs 473ml| 93.0
|Synergy Labs Groomer's Salon Select White Coat Shampoo for Dogs 544ml| 39.0
|Bioline Finger Toothbrush Dental Care for Dogs 2pcs| 11.0
|Bioline Styptic Powder First Aid & Recovery for Dogs & Cats 14g| 27.0
|PADO Sand Perch U-Shape for Large Parrots 59cm| 76.0
|Padovan Pallanido Bird Nesting Material for Birds 7x7.5cm| 9.0
|PADO Grass Tippi Treats for Small Pets 15cm| 20.0
|Duvo+ Natural Wood Fibre Bedding for Small Pets| 12.0
|Duvo+ Natural Wood Fibre Bedding for Small Pets| 24.15
|Padovan Sanipet Litter for Bird & Small Pets 10L| 50.0
|Padovan  Non-Clumping Woody Pellets Litter for Cat, Bird & Small Pets 10L| 46.0
|DaYang Rabbit Cage R-5 Enclosure for Small Pets 118.5x62x57cm| 517.0
|DaYang Rabbit Cage R-6 Enclosure for Small Pets 149x76x64cm| 597.0
|DaYang Rabbit Cage R-4 Enclosure for Small Pets 99x56x54cm| 298.0
|Bioline Flea & Tick Collar for Cats 35cm| 27.0
|Petmode Carrier Kennel for Dogs & Cats| 216.0
|Petmode Carrier Kennel for Dogs & Cats| 756.0
|Petmode Carrier Kennel for Dogs & Cats| 340.0
|Petmode Carrier Kennel for Dogs & Cats| 122.0
|Petmode Carrier Kennel for Dogs & Cats| 936.0
|Petmode Carrier Kennel for Dogs & Cats| 1791.0
|PADO Bird Toy Wood & Bells on Chain 20x6cm| 25.0
|Pado Wheel Type Toy Birds 25x75cm| 26.0
|PADO Bird Toy Ring with Rope 28x20cm| 21.0
|PADO Loaded Banana Bird Toy 52x17cm| 70.0
|Duvo+ Birds Shower Spray Liquid for Birds 500ml| 48.0
|PADO Bird Harness for Parrots| 50.0
|PADO Bird Harness for Parrots| 66.0
|CAT LEADER Clumping Ultra Compact Cat Litter 10kg| 52.0
|Richard's Organics Flea & Tick Shampoo for Dogs 12oz| 55.0
|Richard's Organics Flea & Tick Spray for Dogs 12oz| 55.0
|Padovan PetPad Regular Training Pee Pads for Dogs| 27.0
|Padovan PetPad Regular Training Pee Pads for Dogs| 93.0
|Richards Organics Stain Remover & Deodorizer Cleaner for Dogs & Cats 946ml| 63.0
|Duvo+ Dwarf Hamster Ball Toy for Small Pets| 21.0
|Duvo+ Dwarf Hamster Ball Toy for Small Pets| 25.0
|Tropical Bird Wave Bird Cage 55x47x36cm| 138.0
|Tropical Bird Cockatoo Residence Bird Cage 115x92x164cm| 1247.0
|Tropical Bird Greys World Bird Cage| 800.0
|Tropical Bird Greys World Bird Cage| 800.0
|Tropical Bird Cockatoo Villa Bird Cage| 1155.0
|Tropical Bird Cockatoo Villa Bird Cage| 1155.0
|Tropical Bird Lovebirds House Bird Cage 47.5x36x68cm| 110.0
|Tropical Bird Finch Mansion Bird Cage 47x36x68cm| 110.0
|Tropical Bird Macaw Kingdom Bird Cage| 1400.0
|Tropical Bird Macaw Kingdom Bird Cage| 1400.0
|Tropical Bird Cockatoo World Bird Cage 102x80x172cm| 1150.0
|PADO Shower and Window Perch for Birds 4x35.5cm| 130.0
|PADO Curvy Calcium Stick for Birds 42x22cm| 44.0
|PADO Straight Plain Calcium Perch for Birds 3.5-4.5x3.5cm| 63.0
|Zoetis Cazitel Plus Dewormer Tablet for Dogs 1 tablet| 15.0
|Advantix for Ticks & Fleas for Dogs| 189.0
|Advantix for Ticks & Fleas for Dogs| 208.0
|Advantix for Ticks & Fleas for Dogs| 227.0
|Advantix for Ticks & Fleas for Dogs| 246.0
|earthbath Spritz Puppy Deodorizer 37ml| 70.0
|earthbath Spritz Lavender Deodorizer 8oz| 69.0
|earthbath Grooming Ultra-Mild Puppy Wipes Wild Cherry 100pcs| 87.0
|earthbath Puppy Shampoo 472ml| 80.0
|earthbath Oatmeal & Aloe Shampoo Fragrance 16oz| 94.0
|earthbath Grooming Wipes Green Tea & Awapuhi for Dogs 100pcs| 87.0
|earthbath Oatmeal & Aloe Conditioner Vanilla & Almond for Dogs & Cats 16oz| 80.0
|earthbath Oatmeal & Aloe Shampoo Vanilla & Almond for Dogs 16oz| 94.0
|Vets+Best Hot Spot Spray for Dogs Skin & Coat Care 235ml| 59.0
|Vets+Best Natural Flea + Tick Home Spray for Cats 32oz| 92.4
|Vets+Best Natural Flea + Tick Home Spray for Dogs & Cats 945ml| 93.0
|Simple Solution Chew Stopper Spray for Dog 500ml| 56.7
|Midwest Snapy Fit Water & Feed Bowl| 47.25
|Midwest Snapy Fit Water & Feed Bowl| 59.0
|Midwest Snapy Fit Water & Feed Bowl| 67.0
|Midwest Snapy Fit Water & Feed Bowl| 90.5
|Gigwi Durable Johnny Stick Treat Dispenser Toy for Dogs 20.5x5.5x5.5cm| 36.75
|Gigwi Transparent Squeaker Ball Toy for Dogs 6cm| 15.75
|Gigwi Push To Mute Rugby Ball Toy for Dogs 7.5x7.5x7.5cm| 42.0
|Gigwi Push to Mute Regular Ball Toy for Dogs 7.5x7.5x7.5cm| 37.0
|Gigwi Extra Durable Johnny Stick Toy for Dogs| 42.0
|Gigwi Extra Durable Johnny Stick Toy for Dogs| 42.0
|Gigwi Push to Mute Duck with Plush Tail Toy for Dogs| 37.0
|Gigwi Push to Mute Duck with Plush Tail Toy for Dogs| 37.0
|Gigwi Duraspikes Extra Durable Rabbit Toy for Dogs 26x20x15cm| 63.0
|Gigwi Small Squeaker Ball Toy for Dogs 5cm| 39.9
|Gigwi Medium Squeaker Ball Toy for Dogs 6cm| 39.9
|Midwest Collapsible Playpen for Cats 91.5x60x128cm| 885.0
|Go Pet Club Model F2080 Cat Tree 183cm| 893.0
|Go Pet Club Model FC01 Cat Tree 269cm| 1155.0
|Go Pet Club Cat Tree Climber with Swing 222cm| 1522.5
|Bergan Replacement Scratch Pads for Cats 2pcs| 42.0
|Gigwi Mouse Melody Chaser Cat Toy 19.5x6x4cm| 21.0
|Gigwi Bee Melody Chaser Cat Toy 9.5x6x6cm| 21.0
|Gigwi Bird Melody Chaser Cat Toy 14x7x5.5cm| 21.0
|Gigwi Mouse with Refillable Catnip Cat Toy 16x14x25cm| 21.0
|Gigwi Melody Tube Chaser Coon with Sound Chip Cat Toy 22x8.5x8.5cm| 40.0
|Gigwi Sheep with Refillable Catnip Cat Toy 12x3x9.6cm| 21.0
|Gigwi Bear with Refillable Catnip Cat Toy 12x3x9.6cm| 21.0
|Gigwi Petroid Rototeaser Cat Toy 20.8x12.6x7.8cm| 78.75
|MP Bergamo Bracco Wheels 4pcs| 116.0
|earthbath 2 in 1 Cat Shampoo 16oz| 80.0
|earthbath Hypo-Allergenic Grooming Wipes Fragrance Free for Dogs & Cats 100pcs| 87.0
|earthbath Hypo-Allergenic Grooming Foam for Cats 4oz| 47.25
|PetAg Nursing Kit for Pets 2oz| 26.25
|earthbath Hypo-Allergenic Cat Shampoo 472ml| 79.8
|Midwest Ombre Mocha Swirl Fur Bed for Dogs| 91.0
|Midwest Ombre Mocha Swirl Fur Bed for Dogs| 226.0
|Midwest Ombre Mocha Swirl Fur Bed for Dogs| 270.0
|Midwest Ombre Mocha Swirl Fur Bed for Dogs| 330.0
|Midwest Paw Print Reversible Fleece Stuffed Bed for Dogs| 171.0
|Midwest Paw Print Reversible Fleece Stuffed Bed for Dogs| 350.0
|Kit Cat SoyaClump Soybean Cat Litter| 36.75
|Kit Cat SoyaClump Soybean Cat Litter| 36.75
|Kit Cat SoyaClump Soybean Cat Litter| 36.75
|Kit Cat SoyaClump Soybean Cat Litter| 37.0
|Kit Cat SoyaClump Soybean Cat Litter| 36.75
|Canada LITTER Scented Clumping Cat Litter| 122.85
|Canada LITTER Scented Clumping Cat Litter| 55.85
|Canada LITTER Scented Clumping Cat Litter| 69.3
|Canada LITTER Scented Clumping Cat Litter| 122.85
|Canada LITTER Scented Clumping Cat Litter| 55.85
|Canada LITTER Clumping Cat Litter| 122.85
|Canada LITTER Clumping Cat Litter| 55.85
|Canada LITTER Multi-Cat Clumping Cat Litter| 131.25
|Canada LITTER Multi-Cat Clumping Cat Litter| 131.25
|Simple Solution Cat Litter Odour Eliminator 500ml| 68.25
|PetAg High Calorie Gel for Cats 100G| 48.0
|PetAg Hairball Solution Gel for Cats 100G| 48.0
|PetAg Vitamin & Mineral Gel for Cats 100G| 48.0
|Simple Solution Puppy Aid Training Spray 500ml| 68.25
|Midwest Exercise Pen with MAX Lock Door Cage for Dogs & Cats| 322.0
|Midwest Exercise Pen with MAX Lock Door Cage for Dogs & Cats| 357.0
|Midwest Exercise Pen with MAX Lock Door Cage for Dogs & Cats| 451.0
|Midwest Exercise Pen with MAX Lock Door Cage for Dogs & Cats| 530.25
|Midwest Exercise Pen with MAX Lock Door Cage for Dogs & Cats| 590.0
|Midwest Double Door Life Stages Crate for Dogs & Cats| 220.5
|Midwest Double Door Life Stages Crate for Dogs & Cats| 246.75
|Midwest Double Door Life Stages Crate for Dogs & Cats| 309.75
|Midwest Double Door Life Stages Crate for Dogs & Cats| 430.5
